{
  "id": "ci-clean-01",
  "agent": "github-triage",
  "version": "0.0.1",
  "startTime": "2026-08-06T10:00:00Z",
  "endTime": "2026-08-06T10:00:05Z",
  "steps": [
    {
      "node": "start",
      "type": "node_transition",
      "timestamp": "2026-08-06T10:00:00Z",
      "durationMs": 5
    },
    {
      "llm": "gemini-2.5-flash",
      "type": "llm_call",
      "timestamp": "2026-08-06T10:00:01Z",
      "output": "I will fetch the open issues.",
      "cost": 0.00004,
      "inputTokens": 320,
      "outputTokens": 24,
      "durationMs": 900
    },
    {
      "tool": "fetch_issues",
      "type": "tool_call",
      "timestamp": "2026-08-06T10:00:02Z",
      "input": {"repo": "golang/example"},
      "durationMs": 300
    },
    {
      "tool": "fetch_issues",
      "type": "tool_result",
      "timestamp": "2026-08-06T10:00:03Z",
      "output": {"count": 1, "issues": [{"number": 1, "title": "Docs typo", "labels": []}]},
      "durationMs": 300
    },
    {
      "llm": "gemini-2.5-flash",
      "type": "llm_call",
      "timestamp": "2026-08-06T10:00:04Z",
      "output": "1 documentation issue (#1). Summary: 1 doc.",
      "cost": 0.00006,
      "inputTokens": 410,
      "outputTokens": 52,
      "durationMs": 800
    },
    {
      "node": "end",
      "type": "node_transition",
      "timestamp": "2026-08-06T10:00:05Z",
      "durationMs": 4
    }
  ]
}
