{
  "id": "run-ok-123",
  "agent": "data_extractor",
  "version": "1.2.0",
  "startTime": "2026-06-12T14:00:00Z",
  "endTime": "2026-06-12T14:00:05Z",
  "steps": [
    {
      "tool": "postgres_query",
      "type": "tool_call",
      "timestamp": "2026-06-12T14:00:03Z",
      "input": {"query": "SELECT id FROM users"},
      "durationMs": 450
    },
    {
      "tool": "postgres_query",
      "type": "tool_result",
      "timestamp": "2026-06-12T14:00:04Z",
      "output": [{"id": 1}],
      "durationMs": 500
    }
  ]
}
